{
  "clusterArn": "arn:aws:ecs:us-east-1:123456789012:cluster/my-fargate-cluster",
  "clusterName": "my-fargate-cluster",
  "status": "ACTIVE",
  "registeredContainerInstancesCount": 0,
  "runningTasksCount": 5,
  "pendingTasksCount": 0,
  "activeServicesCount": 2,
  "tags": [
    "example-value"
  ],
  "settings": [
    "example-value"
  ]
}